{
  "id": "resp_0965b819bb516ad10069dc4f2562d08197a19a86f2012b40e1",
  "created_at": 1776045861.0,
  "error": null,
  "incomplete_details": null,
  "instructions": null,
  "metadata": {},
  "model": "gpt-5.2-2025-12-11",
  "object": "response",
  "output": [
    {
      "id": "msg_0965b819bb516ad10069dc4f26b8908197a68b94a7b2cc46fd",
      "content": [
        {
          "annotations": [],
          "text": "The **Vegas Golden Knights** won the **2023 Stanley Cup**, defeating the **Florida Panthers** in **five games (4–1)**.",
          "type": "output_text",
          "logprobs": []
        }
      ],
      "role": "assistant",
      "status": "completed",
      "type": "message",
      "phase": null
    }
  ],
  "parallel_tool_calls": true,
  "temperature": 0.7,
  "tool_choice": "auto",
  "tools": [],
  "top_p": 0.98,
  "background": false,
  "completed_at": 1776045863.0,
  "conversation": null,
  "max_output_tokens": 1000,
  "max_tool_calls": null,
  "previous_response_id": null,
  "prompt": null,
  "prompt_cache_key": null,
  "prompt_cache_retention": null,
  "reasoning": {
    "effort": "none",
    "generate_summary": null,
    "summary": null
  },
  "safety_identifier": null,
  "service_tier": "default",
  "status": "completed",
  "text": {
    "format": {
      "type": "text"
    },
    "verbosity": "medium"
  },
  "top_logprobs": 0,
  "truncation": "disabled",
  "usage": {
    "input_tokens": 16,
    "input_tokens_details": {
      "cached_tokens": 0
    },
    "output_tokens": 34,
    "output_tokens_details": {
      "reasoning_tokens": 0
    },
    "total_tokens": 50
  },
  "user": null,
  "billing": {
    "payer": "developer"
  },
  "frequency_penalty": 0.0,
  "presence_penalty": 0.0,
  "store": true
}